{
  "$schema": "../contracts/compatibility-manifest.schema.json",
  "schemaVersion": "collector.ai-integration.compatibility/v1alpha1",
  "product": {
    "id": "collector-ai-integration",
    "version": "0.0.0-mcp-foundation",
    "phase": "skills_canary",
    "architectureVersion": "v1",
    "license": "Apache-2.0"
  },
  "checkpoint": {
    "completed": [0, 1, 2, 3, 4, 5, 6],
    "current": null,
    "next": null
  },
  "core": {
    "supportedApiSchemaRange": "=3",
    "supportedReleaseRange": "=0.7.17",
    "requiredFeatures": [
      "artifacts.canonical_json_utf8_window.v1",
      "artifacts.metadata.v1",
      "capabilities.direct_contracts.v1",
      "collect.client_request_id.v1",
      "operations.exact_core_state.v1",
      "capabilities.catalog_digest_excludes_runtime_state.v1"
    ],
    "openApiSchemaDigest": "sha256:c1f9b713f7e5ae1bd7d5d4294f08d5bda52b4352f6b30665d4c1b9b168b56cea",
    "capabilityCatalogDigest": "sha256:3c05da851fff32fecf4da4b36ccfcec24a6630118ccd4b2e3552d17caa5b3ab4",
    "directCapabilityIds": [
      "bilibili.video_detail",
      "bilibili.native_search",
      "bilibili.native_search_batch",
      "bilibili.account_profile",
      "bilibili.account_inventory",
      "bilibili.dynamic",
      "bilibili.collection_series.overview",
      "bilibili.collection_series.detail",
      "bilibili.danmaku",
      "bilibili.discussion",
      "xiaohongshu.search.public_notes.v1",
      "xiaohongshu.account.public_notes.v1",
      "xiaohongshu.note.public_detail.v1",
      "xiaohongshu.note.public_comments.v1",
      "xiaohongshu.note.public_comment_replies.v1",
      "zhihu.search.public_content.v1",
      "zhihu.hot_list.public_content.v1",
      "web.search.global.zhihu_provider.v1"
    ]
  },
  "mcp": {
    "implemented": true,
    "protocolVersion": "2025-11-25",
    "defaultTransport": "stdio",
    "toolCatalogVersion": "collector.mcp.tools/v1",
    "tools": [
      {
        "toolId": "collector_bilibili_video_detail",
        "capabilityId": "bilibili.video_detail",
        "inputSchemaDigest": "sha256:5147d9c27669fdaac89d968c50e52745f0346cd96615b8a52f389c34264e13ba"
      },
      {
        "toolId": "collector_bilibili_native_search",
        "capabilityId": "bilibili.native_search",
        "inputSchemaDigest": "sha256:eac1cc4ee519ddc3d6527e3ebe0395e20eb0f231175dba040f861c5d80447a7b"
      },
      {
        "toolId": "collector_bilibili_native_search_batch",
        "capabilityId": "bilibili.native_search_batch",
        "inputSchemaDigest": "sha256:eac1cc4ee519ddc3d6527e3ebe0395e20eb0f231175dba040f861c5d80447a7b"
      },
      {
        "toolId": "collector_bilibili_account_profile",
        "capabilityId": "bilibili.account_profile",
        "inputSchemaDigest": "sha256:df2a67691a6323fcef8995196c76c782a82ee2e6f2a381c6f39047fb512ecb55"
      },
      {
        "toolId": "collector_bilibili_account_inventory",
        "capabilityId": "bilibili.account_inventory",
        "inputSchemaDigest": "sha256:7da9d35d11d4cffb4dbbe2199632bb18c42671e7ff6fa5f622d87477505ecbce"
      },
      {
        "toolId": "collector_bilibili_dynamic",
        "capabilityId": "bilibili.dynamic",
        "inputSchemaDigest": "sha256:df2a67691a6323fcef8995196c76c782a82ee2e6f2a381c6f39047fb512ecb55"
      },
      {
        "toolId": "collector_bilibili_collection_series_overview",
        "capabilityId": "bilibili.collection_series.overview",
        "inputSchemaDigest": "sha256:df2a67691a6323fcef8995196c76c782a82ee2e6f2a381c6f39047fb512ecb55"
      },
      {
        "toolId": "collector_bilibili_collection_series_detail",
        "capabilityId": "bilibili.collection_series.detail",
        "inputSchemaDigest": "sha256:a2f8598ace30a610c53d6c3e817ae7a566d0068cf5935394020571fd0c3b43a6"
      },
      {
        "toolId": "collector_bilibili_danmaku",
        "capabilityId": "bilibili.danmaku",
        "inputSchemaDigest": "sha256:5147d9c27669fdaac89d968c50e52745f0346cd96615b8a52f389c34264e13ba"
      },
      {
        "toolId": "collector_bilibili_discussion",
        "capabilityId": "bilibili.discussion",
        "inputSchemaDigest": "sha256:57386e9ea66b88cd8d7612d7205368c5851793dc725a867d4610cf05c32e37d2"
      },
      {
        "toolId": "collector_xiaohongshu_public_notes_search",
        "capabilityId": "xiaohongshu.search.public_notes.v1",
        "inputSchemaDigest": "sha256:b1e743c0377eb797af4efe7368f8232560b1602b1fb8821507f649851c5e1d66"
      },
      {
        "toolId": "collector_xiaohongshu_account_public_notes",
        "capabilityId": "xiaohongshu.account.public_notes.v1",
        "inputSchemaDigest": "sha256:fe0fe4feb0fe1316b635b16a9909f93067b56bfc64ce80f2cb33cb0788039636"
      },
      {
        "toolId": "collector_xiaohongshu_note_public_detail",
        "capabilityId": "xiaohongshu.note.public_detail.v1",
        "inputSchemaDigest": "sha256:28ce192615f868ef540887baf62ca8e1336cd01170ad3bcf5e2b82a7de64bfc9"
      },
      {
        "toolId": "collector_xiaohongshu_note_public_comments",
        "capabilityId": "xiaohongshu.note.public_comments.v1",
        "inputSchemaDigest": "sha256:9ba2823f54d7771b4fd5609ebed22a129bd59dfc3c666e541c998caa6c5ff17a"
      },
      {
        "toolId": "collector_xiaohongshu_note_public_comment_replies",
        "capabilityId": "xiaohongshu.note.public_comment_replies.v1",
        "inputSchemaDigest": "sha256:2d3fe55775adb116e607fdb617a6db1ba9897ac6fbae2039354ad833621a60aa"
      },
      {
        "toolId": "collector_zhihu_search_public_content",
        "capabilityId": "zhihu.search.public_content.v1",
        "inputSchemaDigest": "sha256:bf5e2a862f2fefb46984ebc44ee30ee92fc64fbafc3c7080c3c59d4d87b831da"
      },
      {
        "toolId": "collector_zhihu_hot_list_public_content",
        "capabilityId": "zhihu.hot_list.public_content.v1",
        "inputSchemaDigest": "sha256:f980504ef3c3dc02040a2893ef1b394254c167975c47a565ac1da1c4e312185a"
      },
      {
        "toolId": "collector_web_search_global_zhihu_provider",
        "capabilityId": "web.search.global.zhihu_provider.v1",
        "inputSchemaDigest": "sha256:706020080e7e02e3c0ac926fe5ef661ff36a201e8885624fdda35fe3302325c7"
      }
    ],
    "resources": [
      "collector://release",
      "collector://capabilities",
      "collector://bindings",
      "collector://operations/{operationId}",
      "collector://artifacts/{artifactId}",
      "collector://artifacts/{artifactId}/chunks/{cursor}"
    ]
  },
  "skills": {
    "official": [
      {
        "skillId": "use-collector-mcp",
        "skillVersion": "0.1.0",
        "digest": "sha256:bdd7bb63be161e406f12e4047ca396cbc457d4d733919a9ba55df6accdf81ec9"
      },
      {
        "skillId": "collect-bilibili",
        "skillVersion": "0.1.0",
        "digest": "sha256:fe4ce68150e88719ea17f8d307a850a40c8ef208a8d08dde6da538c5f0052b1c"
      },
      {
        "skillId": "collect-xiaohongshu",
        "skillVersion": "0.1.0",
        "digest": "sha256:5c33346f92f065c7feb476ed25e0c788a62ea85fad65372b1d336448460c0ab6"
      },
      {
        "skillId": "research-search-then-detail",
        "skillVersion": "0.1.0",
        "digest": "sha256:fa34143d129c65ca440a655fa3c9c43619ed725f0ba198d2b1669c167af5687e"
      },
      {
        "skillId": "collect-zhihu",
        "skillVersion": "0.1.0",
        "digest": "sha256:f89485dffcd80ca133016ef67d1e155e7a9b2ac7255123da5685ba9564432251"
      }
    ]
  },
  "support": {
    "operatingSystems": ["windows"],
    "browsers": [],
    "verifiedConfigurations": [
      {
        "level": "l2",
        "operatingSystem": "windows",
        "nodeVersion": "24.13.0",
        "transport": "stdio",
        "coreRelease": "0.7.17",
        "coreServiceSchema": 3,
        "platformOperationsCreated": 0
      },
      {
        "level": "l3",
        "operatingSystem": "windows",
        "nodeVersion": "24.13.0",
        "transport": "stdio",
        "coreRelease": "0.7.17",
        "coreServiceSchema": 3,
        "browserMode": "user_owned_browser_production_mv3",
        "platform": "bilibili",
        "toolId": "collector_bilibili_native_search",
        "capabilityId": "bilibili.native_search",
        "terminalCoreState": "completed",
        "artifactRepresentation": "canonical_json_utf8",
        "artifactByteLength": 12816,
        "platformOperationsCreated": 1,
        "idempotentReconciliationVerified": true,
        "verifiedAt": "2026-08-03"
      },
      {
        "level": "l4",
        "operatingSystem": "windows",
        "agentHost": "codex-cli",
        "agentHostVersion": "0.144.4",
        "transport": "stdio",
        "coreRelease": "0.7.17",
        "coreServiceSchema": 3,
        "browserMode": "user_owned_browser_production_mv3",
        "platform": "bilibili",
        "toolId": "collector_bilibili_native_search",
        "capabilityId": "bilibili.native_search",
        "pinnedSkillIds": ["use-collector-mcp", "collect-bilibili"],
        "targetToolCallCount": 1,
        "idempotentReplay": true,
        "newPlatformOperationsCreated": 0,
        "artifactByteLength": 12816,
        "verifiedAt": "2026-08-03"
      }
    ]
  },
  "guardrails": {
    "forbiddenRuntimeFeatures": [
      "arbitrary_browser_control",
      "browser_profile_lifecycle",
      "deepresearch_or_model_provider",
      "inteligence_apps_runtime_dependency",
      "knowledge_pack_or_analysis_service",
      "unbounded_artifact_access",
      "workflow_planner_task_run_service"
    ]
  },
  "verification": {
    "highestCompletedLevel": "l4",
    "evidence": [
      {
        "kind": "repository_boundary_gate",
        "command": "python scripts/verify_repository.py"
      },
      {
        "kind": "mcp_l1_contract_gate",
        "command": "npm run test:l1"
      },
      {
        "kind": "skill_creator_quick_validation",
        "command": "python -X utf8 <skill-creator>/scripts/quick_validate.py <official-skill-directory>"
      },
      {
        "kind": "official_skill_package_gate",